{
  "schema_version": "tool_manifest/v1",
  "manifest_id": "tomorrowci-lab",
  "display_name": "TomorrowCI bounded trust-behavior audit",
  "stability": "experimental",
  "enabled_by_default": false,
  "adapter": { "id": "tomorrowci-trust-audit", "version": "1" },
  "identity_contract": {
    "executable_candidates": ["tomorrowci"],
    "version_probe": { "arguments": ["--version"] },
    "binary_digest_required": true,
    "allowed_binary_sha256": ["5a79d242d575c6eb37ed8790974cded4561e36266b5d006a783777b210a15f4f"],
    "python_distribution": null,
    "supporting_tree_digest_required": false
  },
  "subject_kind": "self_foundation",
  "invocation_contract": {
    "mode": "direct_exec",
    "operation": "tomorrowci_trust_audit",
    "parameters": [],
    "required_capabilities": ["inspect_host_tooling"],
    "target_code_execution": "none",
    "network": "none_expected",
    "filesystem_write": "captured_streams_only"
  },
  "artifact_contracts": [
    { "role": "native_stdout", "discovery": "captured_stream", "required_when": "spawned", "byte_policy": "exact" },
    { "role": "native_stderr", "discovery": "captured_stream", "required_when": "spawned", "byte_policy": "exact" }
  ],
  "native_observation_contracts": [
    { "namespace": "tomorrowci", "name": "overall", "artifact_role": "native_stdout", "format": "json", "selector": "/overall", "required_when": "process_exited", "unknown_value_policy": "preserve_unrecognized" },
    { "namespace": "tomorrowci", "name": "t5_engine_honest_verdict", "artifact_role": "native_stdout", "format": "json", "selector": "/probes/4/verdict", "required_when": "process_exited", "unknown_value_policy": "preserve_unrecognized" },
    { "namespace": "tomorrowci", "name": "t8_git_verdict", "artifact_role": "native_stdout", "format": "json", "selector": "/probes/7/verdict", "required_when": "process_exited", "unknown_value_policy": "preserve_unrecognized" }
  ],
  "exit_code_contract": {
    "entries": [
      { "code": 0, "native_meaning": "trust_audit_completed" }
    ],
    "unknown_code_policy": "preserve_unrecognized"
  },
  "authority_contract": { "mode": "not_reported" },
  "limitations": [
    { "code": "candidate_only_not_release_authorized", "statement": "The pinned v0.2.0-alpha.1 delivery identifies itself as CANDIDATE_ONLY_NOT_RELEASE_AUTHORIZED." },
    { "code": "unbound_vcruntime140_dll", "statement": "The exact executable imports app-local-resolvable VCRUNTIME140.dll, but the release and EWB plan bind only the executable; planning remains disabled until the non-platform DLL closure is admitted and locked." },
    { "code": "fixed_trust_audit_only", "statement": "This adapter runs only TomorrowCI's native trust-behavior audit; it does not scan a repository or execute target code." },
    { "code": "host_probes_deliberately_isolated", "statement": "EWB supplies this operation an EWB-owned, content-addressed empty PATH (and .EXE-only PATHEXT on Windows), so native T5 and T8 intentionally report BLOCKED and cannot launch ambient Docker, Podman, or Git binaries." },
    { "code": "same_user_path_race_not_contained", "statement": "EWB verifies the owned PATH directory is real and empty immediately before spawn and keeps it for the child lifetime, but this is not same-user operating-system containment; a concurrent process with the same user authority could still race the directory after verification." },
    { "code": "native_overall_not_authority", "statement": "The native overall field is only a preserved projection and is never promoted into workbench authority; upstream may report overall PASS while the deliberately isolated T5 and T8 host probes report BLOCKED." },
    { "code": "direct_process_not_os_sandbox", "statement": "Capability approval constrains this adapter invocation; it is not an operating-system sandbox." }
  ]
}
