{
  "schema_version": "tool_manifest/v1", "manifest_id": "normshift", "display_name": "NormShift semantic standards diff", "stability": "experimental", "enabled_by_default": false,
  "adapter": { "id": "catalog-only-normshift", "version": "1" },
  "identity_contract": { "executable_candidates": ["normshift"], "version_probe": { "arguments": ["--version"] }, "binary_digest_required": true, "python_distribution": "normshift", "supporting_tree_digest_required": true },
  "subject_kind": "artifact",
  "invocation_contract": { "mode": "direct_exec", "operation": "catalog_only", "parameters": [], "required_capabilities": ["read_artifact"], "target_code_execution": "none", "network": "none_for_local_diff", "filesystem_write": "report" },
  "artifact_contracts": [], "native_observation_contracts": [],
  "exit_code_contract": { "entries": [], "unknown_code_policy": "preserve_unrecognized" },
  "authority_contract": { "mode": "not_reported" },
  "limitations": [
    { "code": "adapter_not_implemented", "statement": "Catalog entry only; execution is disabled in this MVP." },
    { "code": "runtime_and_multifile_subject_missing", "statement": "Current verification needs an immutable Python dependency closure plus a report and exact source tree; EWB has not admitted that multi-file input capsule." },
    { "code": "historical_audit_scope", "statement": "Historical M0 audit evidence must not be projected onto the current experimental source." }
  ]
}
